bass guitar is made up of	four strings
one is made up of	zero
coal is made up of	anthracite
electric fan is made up of	hub
surface is made up of	material
year is made up of	season
ipod is made up of	microchips and plastic
picket fence is made up of	picket
tire is made up of	rubber and latex
anchor is made up of	fluke
apron is made up of	apron string
ear is made up of	earlobe
adult is made up of	adult body
bathroom is made up of	toilet
dial telephone is made up of	dial
cattle is made up of	cow
semen is made up of	sperm cells
dagger is made up of	hilt
kidney is made up of	venae interlobulares renis
table is made up of	leg
sun is made up of	chromosphere
wind instrument is made up of	bell
ax is made up of	ax head
plant is made up of	root
baseball field is made up of	batter's box
truck is made up of	stabilizer bar
rugby is made up of	scrum
playground is made up of	slide
quarter is made up of	bushel
indica is made up of	cannabis
car is made up of	horn
sign language is made up of	sign
team is made up of	bench
address is made up of	zip code
house is made up of	claque
skin is made up of	pressure point
cone is made up of	point
match is made up of	head
liver is made up of	hepatic duct
week is made up of	weekend
loneliness is made up of	emotion
lecture is made up of	lecture demonstration
coat is made up of	coat button
sword is made up of	steel
helicopter is made up of	landing skids
nut and bolt is made up of	nut
silk is made up of	bugs
head is made up of	ear
display is made up of	raster
wind is made up of	moving air
fish is made up of	tail fin
balloon is made up of	envelope
snowflace is made up of	ice
orchestra is made up of	section
scene is made up of	subject
hammer is made up of	head
bone is made up of	bone marrow
pool is made up of	break
window is made up of	sash
fat is made up of	glyceride
pistil is made up of	style
zipper is made up of	teeth
spleen is made up of	splenic vein
tent is made up of	guy
motor vehicle is made up of	gearshift
spider is made up of	leg
rifle is made up of	rifle butt
couple is made up of	moment of couple
bird is made up of	air sac
quadruped is made up of	flank
hog is made up of	pork
movie projector is made up of	lamp house
refrigerator is made up of	icemaker
homer is made up of	cab
card game is made up of	doubling
steel is made up of	iron
eye is made up of	ciliary artery
camera is made up of	lense
jacket is made up of	zipper
radio is made up of	knob
snare drum is made up of	snare
computer is made up of	computer circuit
motorcycle is made up of	mudguard
orange is made up of	slice
square dance is made up of	swing
pen is made up of	ink
company is made up of	employee
cotton candy is made up of	sugar
car seat is made up of	headrest
sea is made up of	water
stock is made up of	share
milk is made up of	minerals
american money is made up of	paper or metal
guitar is made up of	fingerboard
insect is made up of	air sac
door is made up of	handle
court is made up of	witness box
egg shell is made up of	calcium
cake is made up of	ingredients
apple juice is made up of	crushed apples
war is made up of	aggression
bow and arrow is made up of	arrow
beaver is made up of	four legs
potato is made up of	jacket
sole is made up of	ball
mile is made up of	foot
football team is made up of	field goal kicker
mansion is made up of	manor hall
each hand is made up of	one thumb
neck is made up of	cervical artery
hospital is made up of	coronary care unit
telescope is made up of	prism
joke is made up of	punchline
evrything is made up of	atoms
rose is made up of	hip
finger is made up of	pad
beehive is made up of	honeycomb
education is made up of	homework
soccer is made up of	headshot
february is made up of	valentine day
goat is made up of	beard
computer network is made up of	server
tv is made up of	plastic
suspension bridge is made up of	cable
algebra is made up of	variety
automobile is made up of	tail pipe
traingle is made up of	three sides
narration is made up of	body
spur is made up of	rowel
arm is made up of	hand
we is made up of	me
atom is made up of	electrons
glass is made up of	silica
galaxy is made up of	star
league is made up of	mile
dam is made up of	concert
tooth is made up of	crown
media is made up of	news
treadmill is made up of	motor
human skeleton is made up of	bones
factory is made up of	shop floor
rudder is made up of	tiller
railroad track is made up of	track
dog is made up of	flag
barrack is made up of	squad room
recreation is made up of	relaxation
valve is made up of	handwheel
egg is made up of	yolk
u.f.o is made up of	alien material
ocean is made up of	seaweed
shrimp is made up of	swimmeret
illustration is made up of	caption
room is made up of	floor
machine gun is made up of	stock
toy balloon is made up of	rubber
chest is made up of	lid
soda is made up of	carbonated water
fur is made up of	guard hair
cave is made up of	stalactite
most paper is made up of	wood pulp
acorn is made up of	cupule
word digit is made up of	two meanings
hotel is made up of	hotel room
weave is made up of	warp
canberra observatory is made up of	four telescopes under domes
right triangle is made up of	one angle 90 degrees
missile is made up of	nose
pedestal is made up of	dado
lithosphere is made up of	crust
saddle is made up of	stirrup
nature is made up of	human
cargo ship is made up of	freeboard deck
barn is made up of	hayloft
deer is made up of	flag
hill is made up of	hillside
roof is made up of	tile
france is made up of	french southern territories
sperm is made up of	acrosome
stroke is made up of	follow through
slide is made up of	positive
chess set is made up of	chessboard
beef is made up of	beef loin
bagpipe is made up of	chanter
dimension cut stone is made up of	granite
flock is made up of	bird
circulatory system is made up of	liver
troll is made up of	win
transmission is made up of	fluid drive
screen is made up of	foreground
rotor is made up of	impeller
ram is made up of	horn
electric motor is made up of	field magnet
furniture is made up of	wood
grave is made up of	gravestone
electric power is made up of	sunlight
can is made up of	aluminium
wave is made up of	wave front
drawer is made up of	lock
political ideology is made up of	political ideals
transportation is made up of	pickup
forrest is made up of	tree
bus is made up of	window
church is made up of	side chapel
distributor is made up of	capacitor
australia is made up of	5 of world's land mass
vise is made up of	jaw
hypodermic syringe is made up of	hypodermic needle
october is made up of	31 days
keyboard is made up of	tab key
blouse is made up of	neckline
shell is made up of	sliding seat
opera is made up of	supertitle
regatta is made up of	sailboat
blood is made up of	haemogloin
dairy product is made up of	milk
face is made up of	eyebrow
most of human body is made up of	water
brain is made up of	ventricle
brush is made up of	bristle
box is made up of	lid
shirt is made up of	shirtfront
mountain is made up of	mountainside
tennis is made up of	footfault
bible is made up of	text
mob is made up of	people
society is made up of	class
vehicle is made up of	wheel
clock is made up of	clock face
airport is made up of	air terminal
acre is made up of	43 560 square feet
propeller is made up of	blade
temple is made up of	entablature
school is made up of	classroom
tail is made up of	stabilizer
soccer field is made up of	two goals
bank is made up of	vault
sphere is made up of	steradian
sausage is made up of	meat
sheep is made up of	withers
torah is made up of	numbers
chicken is made up of	cock
syringe is made up of	bulb
branch is made up of	bark
program is made up of	instructions
dish is made up of	sauce
Something that happens after PersonX means so much to PersonY is	PersonX gives PersonY an amazing gift
Something that happens after PersonX rides a bicycle is	PersonX gets ready for school
Something that happens after PersonX gives PersonY satisfaction is	PersonX owes PersonY some money
Something that happens after PersonX flicks PersonY's tongue is	PersonX tells PersonY to open their mouth
Something that happens after PersonX sees PersonY immediately is	PersonX walks down the street
Something that happens after PersonX decides to check it out is	PersonX sees a new bookstore
Something that happens after PersonX decides to propose to PersonY is	PersonX gets pregnant
Something that happens after PersonX wants a job is	PersonX attends the job interview
Something that happens after PersonX gives PersonY a character is	PersonX sees that his friend wants to play the new game but doesnt have a charcater
Something that happens after PersonX has no money left is	PersonX played the slot machines
Something that happens after PersonX pulls an all-nighter is	PersonX procrastinated during exam time
Something that happens after PersonX practices for hours is	PersonX buys a new violin
Something that happens after PersonX hangs heavy is	PersonX gets terrible news
Something that happens after PersonX becomes homeless is	PersonX gets evicted
Something that happens after PersonX has a lot of energy is	PersonX sleeps very well
Something that happens after PersonX eats healthy foods is	PersonX wants to lose weight
Something that happens after PersonX sheds a tear is	PersonX breaks up with her boyfriend
Something that happens after PersonX gives PersonY employment is	PersonX starts a bakery
Something that happens after PersonX has very long hair is	PersonX dyes their hair blonde
Something that happens after PersonX feels very uncomfortable is	PersonX lies down on the couch
Something that happens after PersonX plays well with others is	PersonX is social
Something that happens after PersonX loves movies is	PersonX bought a bunch of dvds
Something that happens after PersonX gives a pop quiz is	PersonX makes up a quiz
Something that happens after PersonX gives PersonY authority is	PersonX notices PersonY demonstrate leadership ability
Something that happens after PersonX wants a tattoo is	PersonX sees a good tattoo
Something that happens after PersonX sees PersonY's reaction is	PersonX double dips a chip
Something that happens after PersonX rides PersonX's horse is	PersonX puts on the saddle
Something that happens after PersonX is drinking tea is	PersonX pours some liquid into a cup
Something that happens after PersonX tells PersonX's tale is	PersonX returns from a trip at sea
Something that happens after PersonX loses PersonX's job is	PersonX goofs off at work
Something that happens after PersonX makes believe is	PersonX decides to use his imagination
Something that happens after PersonX welcomes PersonY home is	PersonX opens the door to PersonY
Something that happens after PersonX is quite right is	PersonX says that china is making war on the us
Something that happens after PersonX runs out the clock is	PersonX runs all over the football field
Something that happens after PersonX leads PersonY's team to victory is	PersonX practices football
Something that happens after PersonX rids PersonX's skateboard is	PersonX wants to go outside
Something that happens after PersonX turns back to PersonY is	PersonX silences his cellphone
Something that happens after PersonX runs for president is	PersonX calls donors for money
Something that happens after PersonX does a really good job is	PersonX gets hired to clean the park
Something that happens after PersonX smells the barn is	PersonX drives to the barn
Something that happens after PersonX serves PersonY right is	PersonX gets PersonY's meal from the kitchen
Something that happens after PersonX wants a new pair of shoes is	PersonX goes to the shoe store
Something that happens after PersonX accepts PersonY appointment is	PersonX have to meet PersonY
Something that happens after PersonX looks in PersonY direction is	PersonX hears PersonY honk her car corn
Something that happens after PersonX loves PersonX's mother is	PersonX goes to see their mother for her birthday
Something that happens after PersonX tells PersonY something is	PersonX is being secretive
Something that happens after PersonX needs a new cell phone is	PersonX drops their phone
Something that happens after PersonX enjoys PersonX's food is	PersonX cooks a gourmet dinner
Something that happens after PersonX meets PersonX's teacher is	PersonX goes into the office
Something that happens after PersonX memorizes every sign is	PersonX learns the catcher signs
Something that happens after PersonX takes another sip is	PersonX drinks alcohol from the glass
Something that happens after PersonX is always late for work is	PersonX arrives to work late
Something that happens after PersonX hits the high notes is	PersonX sings in the opera
Something that happens after PersonX completes PersonX's course is	PersonX goes to college online
Something that happens after PersonX buys a new pair is	PersonX trips over a ripped shoe sole
Something that happens after PersonX is walking down the sidewalk is	PersonX leaves the house
Something that happens after PersonX complains to PersonX's mother is	PersonX had a bad day at school
Something that happens after PersonX mows PersonY's lawn is	PersonX gets the lawn mower from the garage
Something that happens after PersonX follows PersonY's course is	PersonX gets lost
Something that happens after PersonX likes sports is	PersonX watches sports on t.v
Something that happens after PersonX eats tacos is	PersonX drives to taco bell
Something that happens after PersonX plays basketball at the park is	PersonX asks his friends to join him at the park
Something that happens after PersonX grabs PersonY's wrist is	PersonX struggles to control PersonY
Something that happens after PersonX gets all the ingredients is	PersonX starts making dinner
Something that happens after PersonX lifts PersonY's eyes is	PersonX sees PersonY is asleep
Something that happens after PersonX waters flowers everyday is	PersonX plants a flower garden
Something that happens after PersonX visits PersonY's friends is	PersonX gets in the car and drives
Something that happens after PersonX cradles PersonY's head is	PersonX sees PersonY is crying
Something that happens after PersonX starts reading is	PersonX opens the book
Something that happens after PersonX makes good money is	PersonX got hired for a good job
Something that happens after PersonX takes care of PersonX's children is	PersonX takes their children home
Something that happens after PersonX needs a new car is	PersonX old car has broken down
Something that happens after PersonX opens the closet door is	PersonX took a shower in the morning
Something that happens after PersonX drives too fast is	PersonX is an inexperienced driver
Something that happens after PersonX makes PersonY's hair is	PersonX opens the wig shop
Something that happens after PersonX is moving into a new home is	PersonX gets a new job
Something that happens after PersonX plays the violin is	PersonX gets their violin out of the closet
Something that happens after PersonX misses my flight is	PersonX runs to the gate at the airport
Something that happens after PersonX calls PersonY's friend is	PersonX sees PersonY with a stranger
Something that happens after PersonX works quickly is	PersonX needs to reply to an email from their boss
Something that happens after PersonX searches everywhere for it is	PersonX lost their car keys
Something that happens after PersonX catches sight of PersonY is	PersonX is walking in public
Something that happens after PersonX brings home a gift is	PersonX goes christmas shopping
Something that happens after PersonX takes to PersonX's bed is	PersonX buys a new bd
Something that happens after PersonX baits PersonX's hook is	PersonX wants to tease somebody
Something that happens after PersonX orders some pizza is	PersonX sees its dinner time
Something that happens after PersonX kisses PersonY's hands is	PersonX bows deeply before PersonY
Something that happens after PersonX keeps the equipment in condition is	PersonX wipes down the equipment with a rag and cleaner
Something that happens after PersonX earns enough money is	PersonX has a new job
Something that happens after PersonX walks past is	PersonX sees a large crowd
Something that happens after PersonX returns the ring is	PersonX founds a ring on the subway
Something that happens after PersonX invites PersonY to dinner is	PersonX runs into PersonY at the mall
Something that happens after PersonX talks in circles is	PersonX begins to talk
Something that happens after PersonX is losing the game is	PersonX runs slowly
Something that happens after PersonX pursues PersonX's interests is	PersonX is thinking about PersonX's goal
Something that happens after PersonX parks the bike in the garage is	PersonX rides over to his friend's house
Something that happens after PersonX has a great time is	PersonX went to a concert
Something that happens after PersonX takes dance lessons is	PersonX want to lose weight
Something that happens after PersonX takes out the trash is	PersonX smells an odor
Something that happens after PersonX shuts my eyes is	PersonX notices a creepy dolls for sale
Something that happens after PersonX writes PersonY a letter is	PersonX can't believe their friend moved away
Something that happens after PersonX seriously hurt is	PersonX crashes their motorcycle
Something that happens after PersonX moves to a new city is	PersonX gets a job offer far away
Something that happens after PersonX takes a trip to the beach is	PersonX packs a towel
Something that happens after PersonX gets books back is	PersonX loans books to a friend
Something that happens after PersonX puts kettle back on is	PersonX fills water in kettle
Something that happens after PersonX pulls PersonY's face is	PersonX puts makeup on PersonY
Something that happens after PersonX prevents the animals from passing is	PersonX idles his vehicle at a deer crossing
Something that happens after PersonX is driving on the highway is	PersonX is on a road trip
Something that happens after PersonX bases upon research is	PersonX gives a presentation about their book
Something that happens after PersonX leaves the classroom is	PersonX forgot his backpack
Something that happens after PersonX thinks well of PersonY is	PersonX receives a gift from PersonY
Something that happens after PersonX likes to read is	PersonX is always at the library
Something that happens after PersonX invites all PersonX's friends and family is	PersonX throws a huge party
Something that happens after PersonX teaches PersonY how to knit is	PersonX is a knitting teacher
Something that happens after PersonX receives PersonY kindly is	PersonX sees PersonY at the door
Something that happens after PersonX loves hiking is	PersonX has many hobbies
Something that happens after PersonX holds PersonX's horses is	PersonX is in the barn
Something that happens after PersonX jumps higher is	PersonX wants to win the contest
Something that happens after PersonX wads imagining what PersonY was seeing is	PersonX is asked by PersonY to use their imagination
Something that happens after PersonX sees note 3 is	PersonX reads through the notes from the previous shift
Something that happens after PersonX reads PersonY's favorite book is	PersonX asks PersonY for PersonY's favorite book
Something that happens after PersonX gets a phone is	PersonX loses their phone in the sewer
Something that happens after PersonX is really shy is	PersonX hides from cameras
Something that happens after PersonX tries many times is	PersonX is too heavy to make a pull up
Something that happens after PersonX gives PersonY look is	PersonX hears PersonY say something controversial
Something that happens after PersonX makes it to the top is	PersonX begins to hike up the mountain
Something that happens after PersonX returns a book immediately is	PersonX gets notifies that a book is overdue
Something that happens after PersonX is on a field trip is	PersonX brings his paperwork to school
Something that happens after PersonX fixes PersonX's tire is	PersonX walks out to the car
Something that happens after PersonX runs under the bed is	PersonX is spotted by an moving object
Something that happens after PersonX accepts PersonY's proposal is	PersonX watches PersonY propose
Something that happens after PersonX buys a birthday cake is	PersonX is planning a surprise party
Something that happens after PersonX gives PersonY a break is	PersonX sees PersonY is tired
Something that happens after PersonX damns with faint praise is	PersonX loses a promotion to another worker
Something that happens after PersonX takes it apart is	PersonX notices a fan stopped working
Something that happens after PersonX wishes could say is	PersonX learns a dirty secret
Something that happens after PersonX finds someone is	PersonX needs a prom date
Something that happens after PersonX feels nauseous is	PersonX eats some spicy food
Something that happens after PersonX gets a new haircut is	PersonX has very long hair
Something that happens after PersonX follows PersonY everywhere is	PersonX job shadows PersonY
Something that happens after PersonX lays to rest is	PersonX ran too far on a jog
Something that happens after PersonX works two jobs is	PersonX is taking full time college coursework
Something that happens after PersonX screams PersonY's name is	PersonX is lost in the woods
Something that happens after PersonX starts running every day is	PersonX buys running shoes
Something that happens after PersonX offers the job is	PersonX interviews them for the job
Something that happens after PersonX gets glasses is	PersonX walks into the wrong bathroom
Something that happens after PersonX sets up shop is	PersonX sets up their lemonade stand
Something that happens after PersonX protects PersonX's rights is	PersonX sits down to be questioned
Something that happens after PersonX never used a computer is	PersonX looks at a computer at the store
Something that happens after PersonX puts a computer together is	PersonX buys boards, chips and a case
Something that happens after PersonX finally went is	PersonX awaited the concert
Something that happens after PersonX opens a bottle of wine is	PersonX needs a drink to calm their nerves
Something that happens after PersonX divides the cows among themselves is	PersonX buys some dairy cows
Something that happens after PersonX calls the owner is	PersonX hit the neighbor's car
Something that happens after PersonX gets whats coming to PersonX is	PersonX does a bad thing
Something that happens after PersonX invites PersonY's friends is	PersonX decides to throw a surprise party
Something that happens after PersonX gives PersonY a lecture is	PersonX is doing a lot of charity work
Something that happens after PersonX asks PersonY to turn it down is	PersonX is hearing loud music being played
Something that happens after PersonX forgets PersonX's lunch is	PersonX makes PersonX lunch
Something that happens after PersonX waves back is	PersonX notices some one waving at them
Something that happens after PersonX goes the extra mile is	PersonX volunteers to lead the food drive
Something that happens after PersonX shows PersonY how to play is	PersonX is playing badminton when PersonY comes up
Something that happens after PersonX makes a bowl of cereal is	PersonX gets out a bowl
Something that happens after PersonX is incredibly nervous is	PersonX walks down the aisle of the church
Something that happens after PersonX is on the baseball team is	PersonX practices hitting ball
Something that happens after PersonX knows PersonY could do it is	PersonX watches PersonY struggle lifting weights
Something that happens after PersonX opens all of PersonX's presents is	PersonX sits down near the christmas tree
Something that happens after PersonX draws in a deep breath is	PersonX is feeling faint
Something that happens after PersonX gets better and better is	PersonX practices batting
Something that happens after PersonX leaves to PersonY's own devices is	PersonX is sick of trying to help someone who will not listen
Something that happens after PersonX talks to PersonY's teacher is	PersonX sees an f on PersonY's report card
Something that happens after PersonX gets PersonX's report card is	PersonX cant wait to see his mom
Something that happens after PersonX buys PersonX's new shoes is	PersonX goes to the shoe store
Something that happens after PersonX rocks the boat is	PersonX gets in the boat
Something that happens after PersonX really paying attention is	PersonX signs up for a german class
Something that happens after PersonX throws the football is	PersonX walks outside
Something that happens after PersonX gets back at PersonY is	PersonX formulates a revenge plan
Something that happens after PersonX sends PersonY to summer camp is	PersonX chooses a camp for PersonY
Something that happens after PersonX sees yellow is	PersonX looked at the flower
Something that happens after PersonX kills PersonY's son is	PersonX picks up their gun
Something that happens after PersonX asks the cashier is	PersonX can't find the bananas
Something that happens after PersonX breastfeeds PersonX's baby is	PersonX gets up in the middle of the night
Something that happens after PersonX talks for PersonY hour is	PersonX have something to talk
Something that happens after PersonX appreciates the gesture is	PersonX recognizes what others do for him
Something that happens after PersonX moves to a new neighborhood is	PersonX packs things into moving truck
Something that happens after PersonX hears a knock is	PersonX waits for the mailman
Something that happens after PersonX gets drunk is	PersonX is drinking a lot at party
Something that happens after PersonX practices every single day is	PersonX makes the basketball team
Something that happens after PersonX goes back to PersonY's house is	PersonX leaves his keys at PersonY's house
Something that happens after PersonX feels queasy is	PersonX eats some old cheese
Something that happens after PersonX eats for two is	PersonX gets pregnant
Something that happens after PersonX loves to play tennis is	PersonX needs a hobby
