as a result of PersonX bites PersonY in the arse, others will	none
as a result of PersonX gives ___ a huge hug, others will	they smile
as a result of PersonX wins big, others will	Loses friendship with X
as a result of PersonX opens a store, others will	spend money at store
as a result of PersonX develops PersonY model, others will	none
as a result of PersonX eats a banana, others will	none
as a result of PersonX takes advantage of the situation, others will	none
as a result of PersonX uses ___ to PersonY's advantage, others will	is promoted
as a result of PersonX reaches PersonY's eyes, others will	looks at PersonX
as a result of PersonX applies for a job, others will	none
as a result of PersonX gives chase, others will	sweats
as a result of PersonX watches PersonY's dog, others will	none
as a result of PersonX tells PersonY could do, others will	PersonY is emboldened by PersonX
as a result of PersonX snaps it up, others will	catches X in act
as a result of PersonX rubs PersonY's forehead, others will	forehead gets cleaner
as a result of PersonX lifts PersonY's hand, others will	listens to what PersonX has to say
as a result of PersonX heads home, others will	none
as a result of PersonX accompanies by PersonY's wife, others will	gets ejected from house
as a result of PersonX announces the winners, others will	feel like losers
as a result of PersonX strikes while the iron is hot, others will	none
as a result of PersonX is really cool, others will	none
as a result of PersonX becomes like PersonY, others will	They avoid X
as a result of PersonX gets a date with PersonY, others will	person y is full
as a result of PersonX sounds PersonY alarm, others will	Falls out of bed
as a result of PersonX takes delight in ___, others will	none
as a result of PersonX is familiar to PersonY's ear, others will	relaxes
as a result of PersonX gets PersonY's picture taken, others will	smiles
as a result of PersonX never talked, others will	none
as a result of PersonX gets a phone call, others will	This person talks to PersonX when they answer.
as a result of PersonX stings PersonY's eyes, others will	can't see
as a result of PersonX is pulled over by a cop, others will	places hand on weapon
as a result of PersonX maintains PersonY level, others will	notices the effort
as a result of PersonX begins to feel better, others will	none
as a result of PersonX paints PersonY, others will	is tired
as a result of PersonX shapes PersonY's lives, others will	they learn a lot
as a result of PersonX gives PersonY a gift card, others will	none
as a result of PersonX visits ___ this weekend, others will	none
as a result of PersonX sees a beautiful girl, others will	girl waves at Person X
as a result of PersonX teaches PersonY how, others will	gets a job
as a result of PersonX increases PersonY's income, others will	they are more relaxed
as a result of PersonX cooks dinner for PersonX's family, others will	Sets table
as a result of PersonX calls PersonY friend, others will	blushes
as a result of PersonX clips PersonY, others will	has a bruise
as a result of PersonX washes PersonY face, others will	Face becomes clean
as a result of PersonX wakes PersonY up early, others will	is awoken
as a result of PersonX asks PersonY to tell, others will	be honest
as a result of PersonX grabs PersonY's purse, others will	calls the police
as a result of PersonX is so happy to see PersonY, others will	PERSONY GOES ON A DATE WITH PERSONX
as a result of PersonX waves PersonY away, others will	PersonY was offended at the dismissal
as a result of PersonX raises a hand, others will	picks personX
as a result of PersonX gives PersonX's medicine, others will	none
as a result of PersonX is winning the game, others will	lose
as a result of PersonX takes ___ fishing, others will	get tired
as a result of PersonX improves PersonY's lot, others will	PersonY gets a good grade
as a result of PersonX finally told PersonY, others will	none
as a result of PersonX encourages PersonY, others will	likes PersonX
as a result of PersonX goes pro, others will	none
as a result of PersonX tells PersonY to call, others will	no effect
as a result of PersonX squeezes PersonY's eyes shut, others will	jumps
as a result of PersonX assesses the patient 's ___, others will	wants to get home
as a result of PersonX saves PersonY's skin, others will	goes to the hospital for a checkup
as a result of PersonX makes ___ for everyone, others will	get drunk
as a result of PersonX pays PersonY a compliment, others will	Rebuffs compliment
as a result of PersonX sends PersonX's flowers, others will	smiles
as a result of PersonX watches ___ alone, others will	none
as a result of PersonX gives PersonY some information, others will	read report
as a result of PersonX wraps PersonY's fingers, others will	stops bleeding
as a result of PersonX puts ___ on PersonY's hips, others will	none
as a result of PersonX engages PersonY's attention, others will	Person Y starts to gaze at Person X.
as a result of PersonX parks ___ in the garage, others will	none
as a result of PersonX takes my friend, others will	Person Y makes his flight on time.
as a result of PersonX takes the bus to work, others will	Has someone to start work
as a result of PersonX offer to help PersonY, others will	none
as a result of PersonX starts to die, others will	none
as a result of PersonX shoots at PersonY, others will	none
as a result of PersonX brings PersonY to the doctor, others will	Doctor processes paperwork.
as a result of PersonX produces PersonY output, others will	uses the output to do more things
as a result of PersonX changes PersonY ___ with kings, others will	Social standing is changed
as a result of PersonX seems to PersonY would be, others will	are sweating
as a result of PersonX sends PersonY to PersonZ, others will	greet each other
as a result of PersonX takes a look at PersonY, others will	answers PersonX
as a result of PersonX provides PersonY level, others will	they smile
as a result of PersonX bears PersonY resemblance, others will	no effect
as a result of PersonX goes check it out, others will	none
as a result of PersonX feels something weird, others will	none
as a result of PersonX removes PersonY's clothes, others will	PersonY gets intimate with PersonX
as a result of PersonX makes PersonY study, others will	PersonY learns more about the subject
as a result of PersonX goes ___ instead, others will	none
as a result of PersonX tells PersonX's girlfriend, others will	none
as a result of PersonX puts it in PersonX's mouth, others will	are opening
as a result of PersonX rushes PersonY to the vet, others will	Person Y is treated by the vet
as a result of PersonX makes a movie, others will	none
as a result of PersonX gives PersonY some time, others will	rushed
as a result of PersonX is set up on a blind date, others will	none
as a result of PersonX gives PersonY's hand ___, others will	hand dirty.
as a result of PersonX focuses PersonY's attention, others will	have to have PersonX stand near them
as a result of PersonX teaches PersonX's son, others will	gains knowledge
as a result of PersonX introduces himself to PersonY, others will	*blushes
as a result of PersonX can not help PersonY, others will	Person Y feels like Person X let them down
as a result of PersonX takes advantage of the opportunities, others will	none
as a result of PersonX meets the ___ in the air, others will	enemy cries in pain
as a result of PersonX expresses ___ in terms, others will	gains information
as a result of PersonX provides PersonY means, others will	PersonY thinks about PersonX a lot
as a result of PersonX pushes PersonY aside, others will	fell to the ground
as a result of PersonX is married for 20 years, others will	none
as a result of PersonX sees a squirrel, others will	runs away
as a result of PersonX takes ___ for a drive, others will	none
as a result of PersonX assigns ___ in courses, others will	students have more work
as a result of PersonX maintains PersonY balance, others will	saved from injury
as a result of PersonX works on PersonY's car, others will	gets into an accident
as a result of PersonX breaks the camel 's back, others will	whence in pain
as a result of PersonX calls PersonY's friends, others will	hears the phone
as a result of PersonX guides PersonY even more forcefully onto, others will	saves his life
as a result of PersonX not gives PersonY the time of day, others will	they cry
as a result of PersonX solves PersonY problems, others will	is grateful to personX
as a result of PersonX offers a new job, others will	gains financial security
as a result of PersonX purchases ___ at prices, others will	none
as a result of PersonX derives PersonX's ___ from the consent, others will	none
as a result of PersonX takes PersonY's choice, others will	Wins a negotiation
as a result of PersonX wears ___ with pride, others will	wants to shop for one too
as a result of PersonX governs another ___, others will	none
as a result of PersonX is bothering PersonY, others will	none
as a result of PersonX thanks ___ for PersonY's kindness, others will	Wells up
as a result of PersonX fights fire with fire, others will	backs off from X
as a result of PersonX persuades ___ to come, others will	joins PersonX
as a result of PersonX starts PersonY business, others will	none
as a result of PersonX enforces PersonY's rights, others will	others are able to live according to thier rights
as a result of PersonX changes PersonY, others will	laughs
as a result of PersonX changes PersonY's diet, others will	lose weight
as a result of PersonX explains the rules, others will	PersonY does well at observing the rules
as a result of PersonX gets home, others will	Asks X where they have been
as a result of PersonX takes classes, others will	Other people fail or pass the class.
as a result of PersonX eats PersonY out of house and home, others will	gets eaten
as a result of PersonX tries and fix ___, others will	receive assistance
as a result of PersonX wins the day, others will	none
as a result of PersonX speaks PersonY mind, others will	none
as a result of PersonX works as a cashier, others will	none
as a result of PersonX talks a little bit, others will	answers a question
as a result of PersonX puts PersonX's ___ on the line, others will	PersonX's wife gave him the cold shoulder that night
as a result of PersonX thinks PersonY was ready, others will	accept invitation
as a result of PersonX renders PersonY every ___, others will	gets work done
as a result of PersonX invites PersonY to visit, others will	Talks
as a result of PersonX starts to laugh, others will	smiles
as a result of PersonX feels unprepared, others will	none
as a result of PersonX buys a new tire, others will	none
as a result of PersonX washes PersonY's hands, others will	germ free
as a result of PersonX invites ___ to the party, others will	receives mail
as a result of PersonX eats bacon, others will	none
as a result of PersonX keeps PersonX's head down, others will	none
as a result of PersonX stays put, others will	none
as a result of PersonX ignores PersonY's advice, others will	becomes mad
as a result of PersonX gets stronger, others will	none
as a result of PersonX keeps the home fires burning, others will	none
as a result of PersonX attracts every ___, others will	they compliment him
as a result of PersonX looks PersonY over, others will	is judged by Person X
as a result of PersonX gives PersonY shelter, others will	grabs blanked
as a result of PersonX dresses PersonY, others will	Y is grateful to X
as a result of PersonX walks down the aisle, others will	none
as a result of PersonX looks behind ___, others will	none
as a result of PersonX closes the door behind PersonY, others will	turns towards noise
as a result of PersonX looks at PersonY's friend, others will	makes eye contact
as a result of PersonX hangs around PersonY, others will	none
as a result of PersonX reads PersonY thoughts, others will	PersonY senses a more awkward environment between the two.
as a result of PersonX sends PersonX's ___ to a school, others will	gets dropped off at school
as a result of PersonX takes PersonY to PersonZ, others will	personY is embarrased
as a result of PersonX is at work one ___, others will	none
as a result of PersonX has a big test tomorrow, others will	none
as a result of PersonX plays PersonY ___ in the formation, others will	can laze about.
as a result of PersonX suggests another ___, others will	none
as a result of PersonX stays in PersonY's room, others will	asks for contribution
as a result of PersonX eats PersonY every day, others will	buried
as a result of PersonX fills PersonY's glass, others will	none
as a result of PersonX goes viral, others will	none
as a result of PersonX makes PersonY exception, others will	Exploits X
as a result of PersonX ties PersonY up, others will	struggles
as a result of PersonX taller than PersonY, others will	nothing else
as a result of PersonX gets PersonY's car fixed, others will	Drive off
as a result of PersonX acts on PersonY's behalf, others will	becomes relieved of responsibility
as a result of PersonX uses PersonY's ___ well, others will	none
as a result of PersonX discusses the matter with PersonY, others will	develops understanding
as a result of PersonX gives a ticket, others will	gets arrested for confronting the cop who gives them the ticket
as a result of PersonX wants to go back, others will	none
as a result of PersonX is angry at PersonX's brother, others will	Tries to ptach things up
as a result of PersonX goes bad, others will	none
as a result of PersonX knows throughout the world, others will	none
as a result of PersonX invites ___ to lunch, others will	walk to person x house
as a result of PersonX pulls PersonX's ___ away, others will	none
as a result of PersonX gives jeff ___, others will	makes money
as a result of PersonX takes off PersonY's hat, others will	laughs
as a result of PersonX begs PersonY to let, others will	none
as a result of PersonX sprays PersonY, others will	Gets cold
as a result of PersonX prevents ___ from running, others will	stops running
as a result of PersonX attends PersonX's meetings, others will	TO KNOW SOMETHING
as a result of PersonX has much luck, others will	none
as a result of PersonX spends ___ with PersonX's friends, others will	make tired
as a result of PersonX pushes PersonY, others will	blood pressure goes up
as a result of PersonX runs away from PersonY, others will	Runs out of breath
as a result of PersonX makes PersonY start, others will	stresses about starting
as a result of PersonX needs clothes, others will	none
as a result of PersonX cooks the noodles, others will	smiles
as a result of PersonX thinks it was a good idea, others will	none
as a result of PersonX is riding PersonX's bike, others will	none
as a result of PersonX decides would like, others will	none
as a result of PersonX crunches numbers, others will	none
as a result of PersonX feels like talking, others will	plays video games
as a result of PersonX sees PersonY's cat, others will	They thank person x for bringing the cat home.
as a result of PersonX drives to the store, others will	none
as a result of PersonX includes also the ___, others will	none
as a result of PersonX takes ___ to the sink, others will	none
as a result of PersonX gets a zero, others will	none
as a result of PersonX pushes PersonY's hand, others will	gets shocked and flinches
as a result of PersonX speaks unto PersonY, others will	has a conversation
as a result of PersonX puts PersonY to sleep, others will	falls asleep
as a result of PersonX ends PersonX's trip, others will	yells at personX
as a result of PersonX keeps up appearances, others will	they compliment him
as a result of PersonX breaks PersonY's arm, others will	GET TREATMENT
as a result of PersonX strains every ___, others will	gain new skills
as a result of PersonX lends PersonY the money, others will	is appreciative
as a result of PersonX is the first one, others will	receives compliment for placement
as a result of PersonX loves the snow, others will	none
as a result of PersonX turns PersonY off, others will	is yelled at
as a result of PersonX gives PersonY a grin, others will	thinks PersonX is friendly
as a result of PersonX writes PersonX's letter, others will	none
as a result of PersonX buys ___ with the money, others will	loses an item or service
as a result of PersonX drives to the nearest store, others will	none
as a result of PersonX loves PersonY best, others will	Gets picked on
as a result of PersonX takes PersonX's dog out, others will	none
as a result of PersonX has a difficult time, others will	none
as a result of PersonX finds a kitten, others will	They have to look at pictures of the kitten.
as a result of PersonX uses PersonY's judgment, others will	none
as a result of PersonX never gave PersonY ___, others will	Gains experience in being more assertive
as a result of PersonX introduces another ___, others will	none
as a result of PersonX preaches the gospel to every creature, others will	hear the word of God
as a result of PersonX returns to PersonX's country, others will	government officials will process PersonX's paperwork
as a result of PersonX wants to see a movie, others will	none
as a result of PersonX pursues PersonY, others will	none
as a result of PersonX deepens PersonY's understanding, others will	none
as a result of PersonX gives it to PersonY for PersonZ's birthday, others will	PersonY yells at PersonX
as a result of PersonX makes ___ that night, others will	none
as a result of PersonX looks a ___ in the mouth, others will	none
as a result of PersonX makes smoothies, others will	drinks a smoothie
as a result of PersonX bakes a pie, others will	might eat pie
as a result of PersonX pulls PersonY apart, others will	goes to hospital
as a result of PersonX makes PersonY's statement, others will	none
as a result of PersonX refuses to talk to PersonY, others will	none
as a result of PersonX hears a strange noise, others will	none
as a result of PersonX texts PersonY today, others will	PersonY texts back.
as a result of PersonX has fun with PersonY's friends, others will	joins the game
as a result of PersonX asks if PersonY could help, others will	is thanked for help
as a result of PersonX claps PersonY on the back, others will	shakes PersonX's hand
as a result of PersonX has a birthday coming up, others will	none
as a result of PersonX washes PersonY's disciples ' ___, others will	PersonY's feet gets clean
as a result of PersonX goes back to normal, others will	none
as a result of PersonX buys ___ from the store, others will	HAVE TO ATTEND TO X
as a result of PersonX flies around, others will	none
as a result of PersonX stars back, others will	glances away
as a result of PersonX invites ___ to PersonY's house, others will	Person makes new friend
as a result of PersonX sends PersonY to college, others will	one day they come home from a lecture and see a picture of PersonX that reminds them of all the good times they had together which consequently makes them cry
as a result of PersonX helps PersonY at all, others will	is helped
as a result of PersonX increases students ' ___, others will	enjoyment
as a result of PersonX turns PersonX's coat, others will	none
as a result of PersonX prepares ___ for work, others will	dressed
as a result of PersonX brings tears to my eyes, others will	none
as a result of PersonX gives PersonY a piece, others will	Is fed
as a result of PersonX gets arrested, others will	intergates PersonX
as a result of PersonX throws PersonX's ___ around PersonY, others will	are warm
as a result of PersonX decides to move to PersonY, others will	welcome personX
as a result of PersonX cancels PersonX's date, others will	Gets asked out by someone else
as a result of PersonX takes part in the expedition, others will	fellow expeditioners set up camp
as a result of PersonX is extremely upset, others will	none
as a result of PersonX tells PersonY the story, others will	thinks about it
as a result of PersonX rolls down PersonY's cheeks, others will	wipes cheeks
as a result of PersonX lays on PersonY's back, others will	PersonY's back feels better
as a result of PersonX cleans PersonY's home, others will	transfers money
as a result of PersonX sets the ___ at rest, others will	none
as a result of PersonX has grown into such a gentleman PersonY wondered why PersonY was single, others will	Is interested in X
as a result of PersonX determines a person 's ___, others will	Are affected by a decision
as a result of PersonX holds out PersonY's arms, others will	Feels clasp or person x's hands
as a result of PersonX grabs by the lapels, others will	none
as a result of PersonX rubs PersonY's face, others will	PersonY slaps PersonX
as a result of PersonX falls asleep at PersonY's desk, others will	smiles
as a result of PersonX snuggles PersonY, others will	Person y becomes warmer due to being snuggled
as a result of PersonX asks the cashier, others will	thanks personX
as a result of PersonX is having a party at PersonX's house, others will	none
as a result of PersonX wants PersonY to go, others will	Gets coerced into going
as a result of PersonX heads to PersonY, others will	sees Person X
as a result of PersonX sells ___ online, others will	none
as a result of PersonX carries the ___ far, others will	Other people may decide to riot or march.
as a result of PersonX puts the ___ another way, others will	none
as a result of PersonX marries another ___, others will	are bounding
as a result of PersonX impresses ___ at school, others will	the girl grins
as a result of PersonX takes PersonX's wallet, others will	loses identity
as a result of PersonX pulls ___ towards PersonY, others will	gets dragged
as a result of PersonX clears PersonY's head, others will	becomes more efficient
as a result of PersonX gets PersonY's ___ together, others will	Y thinks of X when using this knowledge.
as a result of PersonX uses PersonY system, others will	none
as a result of PersonX strikes PersonY, others will	yells at PersonX
as a result of PersonX works closely with PersonY, others will	PersonY gets to know PersonX
as a result of PersonX invites all PersonY's friends and family, others will	The invitees leave
as a result of PersonX sees ___ live, others will	Performs to X's expectations
as a result of PersonX accidentally left, others would feel	none
as a result of PersonX spends all PersonX's money, others would feel	annoyed
as a result of PersonX cleans PersonX's apartment, others would feel	good
as a result of PersonX gives PersonY permission, others would feel	satisfied and appreciative.
as a result of PersonX finds a pair of shoes, others would feel	none
as a result of PersonX sets the wheels in motion, others would feel	busy
as a result of PersonX makes eggs, others would feel	none
as a result of PersonX warns PersonY to stop, others would feel	wary about what personx says
as a result of PersonX serves as PersonY instrument, others would feel	strong
as a result of PersonX spends more time with PersonY, others would feel	loved.
as a result of PersonX develops PersonY strategy, others would feel	none
as a result of PersonX supports women 's ___, others would feel	appreciative
as a result of PersonX turns PersonY's head, others would feel	harassed
as a result of PersonX is always hungry, others would feel	none
as a result of PersonX yells surprise, others would feel	happy
as a result of PersonX rubs PersonY's face, others would feel	either mad or good
as a result of PersonX finds ___ on fire, others would feel	none
as a result of PersonX flings open the ___, others would feel	suprised
as a result of PersonX buys coffee, others would feel	happy that their coworker is alert
as a result of PersonX promises PersonY, others would feel	assured
as a result of PersonX makes PersonX's mom happy, others would feel	happy
as a result of PersonX shuts PersonY's mouth, others would feel	angry
as a result of PersonX remembers PersonY's birthday, others would feel	happy to have a good friend
as a result of PersonX buys the ring, others would feel	excited
as a result of PersonX puts PersonX's ___ away, others would feel	none
as a result of PersonX changes the baby 's diaper, others would feel	relieved
as a result of PersonX decides to buy one, others would feel	none
as a result of PersonX meets PersonX's maker, others would feel	sadness
as a result of PersonX takes a sick day, others would feel	none
as a result of PersonX keeps the ___ in place, others would feel	secure
as a result of PersonX establishes PersonY relationship, others would feel	welcomed
as a result of PersonX is late for work ___, others would feel	none
as a result of PersonX lies at PersonY's feet, others would feel	happy
as a result of PersonX is dating PersonY, others would feel	romantic
as a result of PersonX wants to be a teacher, others would feel	like they have someone to educate them
as a result of PersonX gives as good as PersonX gets, others would feel	thankful
as a result of PersonX shows PersonY kindness, others would feel	loved
as a result of PersonX sees things, others would feel	none
as a result of PersonX lays PersonX's ___ together, others would feel	impressed
as a result of PersonX gives PersonY life, others would feel	appreciative
as a result of PersonX makes noise, others would feel	annoyed.
as a result of PersonX conveys PersonY idea, others would feel	bad if the idea is stolen
as a result of PersonX uses drugs, others would feel	none
as a result of PersonX eventually asked ___, others would feel	confused
as a result of PersonX calls to account, others would feel	none
as a result of PersonX gives PersonY a drink, others would feel	good
as a result of PersonX loses PersonX's key, others would feel	none
as a result of PersonX thinks PersonY was incredibly cute, others would feel	none
as a result of PersonX falls into place, others would feel	happy to be on a team
