As a result of PersonX works extra hours, PersonX will	Is tired
As a result of PersonX plays truth, PersonX will	tells an embarrassing story
As a result of PersonX knows PersonY was ready, PersonX will	PersonX knows PersonY well
As a result of PersonX sees ___ soon, PersonX will	smiles
As a result of PersonX spends a week with PersonY, PersonX will	PersonX is given a place to sleep
As a result of PersonX keeps PersonX's ___ under control, PersonX will	lowers heart rate
As a result of PersonX advances towards PersonY, PersonX will	is rebuked
As a result of PersonX comes to PersonY decision, PersonX will	accepts decision
As a result of PersonX starts to die, PersonX will	has hallucinations
As a result of PersonX improves PersonY's health, PersonX will	is thanked by personY
As a result of PersonX stirs men 's ___, PersonX will	receives love letters
As a result of PersonX rises from PersonY's seat, PersonX will	finds correct seat
As a result of PersonX adopts the cat, PersonX will	learns to care for pets
As a result of PersonX invites some friends, PersonX will	acts as a host
As a result of PersonX inspects PersonY, PersonX will	gets stared down
As a result of PersonX spends all of PersonX's time, PersonX will	is late for meeting
As a result of PersonX loses power, PersonX will	sits in dark
As a result of PersonX sticks a fork in an outlet, PersonX will	Person X's hair sticks straight up
As a result of PersonX visits PersonY's parents, PersonX will	make a good impression
As a result of PersonX walks around campus, PersonX will	gets sweaty
As a result of PersonX lifts PersonY's head up, PersonX will	PersonY starts yelling at them
As a result of PersonX wears ___ more often, PersonX will	buys new clothes
As a result of PersonX listens to PersonY's mom, PersonX will	hears a familiar voice
As a result of PersonX is playing at the park, PersonX will	falls
As a result of PersonX gets a dog, PersonX will	person x will have more mess to clean up
As a result of PersonX sees a flyer, PersonX will	learns about the sales going on
As a result of PersonX determines the patient 's ___, PersonX will	gains knowledge on patient
As a result of PersonX shares PersonY with others, PersonX will	gets attacked
As a result of PersonX lies at PersonY's feet, PersonX will	starts massaging PersonY
As a result of PersonX changes PersonX's tire, PersonX will	gains experience
As a result of PersonX stays away from PersonY, PersonX will	estranges themselves.
As a result of PersonX outpope the pope the pope, PersonX will	none
As a result of PersonX recently moved, PersonX will	Changes his address
As a result of PersonX wraps my arms around PersonY, PersonX will	gets pushed away
As a result of PersonX ends PersonX's days, PersonX will	none
As a result of PersonX tears PersonY's ___ away, PersonX will	gets more attention
As a result of PersonX takes PersonX's son out, PersonX will	Losses someone
As a result of PersonX immediately jumped, PersonX will	lands poorly and twists ankle
As a result of PersonX spends ___ with PersonX's families, PersonX will	They make their family happy
As a result of PersonX presses home the ___, PersonX will	none
As a result of PersonX pursues PersonY's way, PersonX will	Steals her boyfriend
As a result of PersonX places first, PersonX will	wins something
As a result of PersonX needs work, PersonX will	leave laziness
As a result of PersonX keeps PersonY commandments, PersonX will	Steals
As a result of PersonX meets a nice girl, PersonX will	he smiles more
As a result of PersonX is able to escape, PersonX will	calls the police
Because of PersonX finds one 's ___, PersonX wanted	none
Because of PersonX has been dating for a year, PersonX wanted	to have a relationship
Because of PersonX makes ___ for PersonY's family, PersonX wanted	to be creative
Because of PersonX works another ___, PersonX wanted	extra money
Because of PersonX takes ___ to a mechanic, PersonX wanted	to get something fixed
Because of PersonX takes ___ to the movies, PersonX wanted	someone to have a good time
Because of PersonX deletes PersonX's account, PersonX wanted	to start over
Because of PersonX finds ___ for sale, PersonX wanted	to make a good choice
Because of PersonX can tell PersonY that PersonY is being solipsist and insolent, PersonX wanted	to assert authority
Because of PersonX finds the culprit, PersonX wanted	they were searching for the culprit and then found someone.
Because of PersonX gets a good look, PersonX wanted	see whats going on
Because of PersonX drives back to the store, PersonX wanted	to retrieve something they forgot
Because of PersonX pushes PersonY away, PersonX wanted	person to go away
Because of PersonX gives PersonY reasons, PersonX wanted	wants to explain why something happened
Because of PersonX persuades PersonY's ___ to let, PersonX wanted	to go on a date with persony's daughter
Because of PersonX loves to read books, PersonX wanted	to educate his or herself
Because of PersonX goes over to PersonY's house, PersonX wanted	to see
Because of PersonX wrests ___ away, PersonX wanted	all of the power
Because of PersonX does n't know how to cook, PersonX wanted	to not learn
Because of PersonX graduates school, PersonX wanted	to be successful
Because of PersonX loves tomatoes, PersonX wanted	to eat fresh vegetables
Because of PersonX buys PersonY a new car, PersonX wanted	to show their wealth
Because of PersonX runs for office, PersonX wanted	to win the election
Because of PersonX puts PersonY aside, PersonX wanted	to make peace.
Because of PersonX discusses every ___, PersonX wanted	there to be no uncertainty
Because of PersonX looks directly at PersonY, PersonX wanted	to be close to person because x loves person.
Because of PersonX sets ___ right, PersonX wanted	to redeem themself
Because of PersonX tickles PersonY, PersonX wanted	to be mischievous
Because of get clean, PersonX wanted	feel fresh and awake
Because of PersonX attends PersonY's funeral, PersonX wanted	to be respectful
Because of PersonX buys PersonX's supplies, PersonX wanted	to be prepared for class
Because of PersonX takes it to the shop, PersonX wanted	to get it fixed
Because of PersonX is having trouble sleeping at night, PersonX wanted	none
Because of PersonX costs ___ a lot of money, PersonX wanted	none
Because of PersonX persuades ___ to follow, PersonX wanted	to lead __
Because of PersonX files for unemployment, PersonX wanted	to get some benefits
Because of PersonX talks to PersonY's brother, PersonX wanted	to be nice
Because of PersonX assesses the patient 's ___, PersonX wanted	to know more
Because of PersonX picks up PersonY's pace, PersonX wanted	to be helpful
Because of PersonX finds a ___ soon, PersonX wanted	it is search the job of people
Because of PersonX continues PersonX's work, PersonX wanted	to get work done
Because of PersonX leaves PersonY's house, PersonX wanted	to go home
Because of PersonX needs money badly, PersonX wanted	pay his apartment rent on time.
Because of PersonX writes a grocery list, PersonX wanted	to make sure to get everything needed
Because of PersonX calls PersonX's brother, PersonX wanted	to talk to their sibling
Because of PersonX follows the rules, PersonX wanted	to be a good girl
Because of PersonX throws PersonY a surprise party, PersonX wanted	to be thoughtful.
Because of PersonX carries the ___ forward, PersonX wanted	continue something
Because of PersonX treats PersonY with respect, PersonX wanted	to be respected in return
Because of PersonX blocks PersonY's path, PersonX wanted	to stop y
Because of PersonX simply buy ___, PersonX wanted	to have something simple
Because of PersonX deflects ___ away, PersonX wanted	to avoid the drama.
Because of PersonX draws a line, PersonX wanted	to be understood
Because of PersonX carries PersonY's ___ far, PersonX wanted	to watch something interesting, to see friends, to go on a date
Because of PersonX brings gifts, PersonX wanted	to show appreciation
Because of PersonX cries like a PersonY, PersonX wanted	to be cries
Because of PersonX keeps the ___ under control, PersonX wanted	to be in charge
Because of PersonX tells by PersonY idiot, PersonX wanted	persony did something foolish
Because of PersonX takes ___ last week, PersonX wanted	to be clean
Because of PersonX minds PersonX's ps and qs, PersonX wanted	not to get in trouble
Because of PersonX drinks a soda, PersonX wanted	to feel satisfied
Because of PersonX wants to work, PersonX wanted	have money
Because of PersonX has a bad day at work, PersonX wanted	none
Because of PersonX decides to try out for the team, PersonX wanted	be a part of the team
Because of PersonX gives PersonY's daughter ___, PersonX wanted	to be hepful
Because of PersonX gets a new boss, PersonX wanted	none
Because of PersonX narrows PersonX's choices down, PersonX wanted	to make a decision
Because of PersonX yells for help, PersonX wanted	to come out of the pit he had fallen into
Because of PersonX starts yelling, PersonX wanted	to express anger
Because of PersonX provides PersonY index, PersonX wanted	to be helpful
Because of PersonX works this morning, PersonX wanted	to make money for his food
Because of PersonX gives ___ a shot, PersonX wanted	to get someone drunk
Because of PersonX needs to use the bathroom, PersonX wanted	to relieve themselves
Because of PersonX leaves the ___ in PersonY's hands, PersonX wanted	to relieve theirself of work
Because of PersonX gives away ___, PersonX wanted	to give something away
Because of PersonX finds PersonY's mom, PersonX wanted	to tell her to pick up persony.
Because of PersonX makes a point, PersonX wanted	none
Because of PersonX plays the clarinet, PersonX wanted	to entertain people
Because of PersonX decides to go camping, PersonX wanted	have a good time out
Because of PersonX drops PersonY's arms, PersonX wanted	to not with person
Because of PersonX uses PersonY's ___ to secure, PersonX wanted	in control, in charge
Because of PersonX gives PersonY something, PersonX wanted	to surprise
Because of PersonX takes PersonY action, PersonX wanted	to help
Because of PersonX lets PersonX's play, PersonX wanted	to play
Because of PersonX defends PersonY's rights, PersonX wanted	to help person y.
Because of PersonX pops ___ in the oven, PersonX wanted	to cook it
Because of PersonX thanks ___ for the help, PersonX wanted	to be respectful
Because of PersonX gets food poisoning, PersonX wanted	none
Because of PersonX rolls the dice, PersonX wanted	to feel lucky
Because of PersonX improves PersonY's understanding, PersonX wanted	to help someone learn
Because of PersonX makes a lot of new friends, PersonX wanted	to be included.
Because of PersonX serves the ___ well, PersonX wanted	none
Because of PersonX takes my dog for a walk, PersonX wanted	person x loves pets
Because of PersonX changes PersonY's mind, PersonX wanted	to convince person
Because of PersonX perfects PersonX's craft, PersonX wanted	the craft to be perfect.
Because of PersonX lives with PersonY's sister, PersonX wanted	none
Because of PersonX buys a drink, PersonX wanted	to fulfill thirsty
Because of PersonX borrows money, PersonX wanted	to be able to pay some bills
Because of PersonX tells PersonY what happened, PersonX wanted	to inform the other person.
Because of PersonX parks the bus, PersonX wanted	to stop and think
Because of christmas shop, PersonX wanted	buy gifts
Because of PersonX sets the ___ right, PersonX wanted	to be understood
Because of PersonX wants to impress PersonY's friends, PersonX wanted	to show off
Because of PersonX takes the picture, PersonX wanted	to capture the moment
Because of PersonX calls ___ yesterday, PersonX wanted	to know what the plans were
Because of PersonX goes to the nurse 's office, PersonX wanted	to get something for a headache
Because of PersonX finds a snake, PersonX wanted	to explore nature
Because of PersonX takes ___ every night, PersonX wanted	to take care of him/herself
Because of PersonX enjoys the experience, PersonX wanted	none
Because of PersonX tries PersonY experiment, PersonX wanted	to be helpful
Because of PersonX takes a ferry, PersonX wanted	to be on the water
Because of PersonX buys the ticket, PersonX wanted	to see the show
Because of PersonX has never cooked before, PersonX wanted	to get started cooking
Because of PersonX carries ___ back, PersonX wanted	to be helpful
Because of PersonX takes ___ to las vegas, PersonX wanted	to show someone a good time
Because of PersonX asks PersonX's friend for help, PersonX wanted	to move a sofa.
Because of PersonX lets it cool, PersonX wanted	to get safe
Because of PersonX spends ___ teaching, PersonX wanted	feel the excitement of opening minds
Because of PersonX persuades the ___ to adopt, PersonX wanted	to be influential
Because of PersonX buys a new cell phone, PersonX wanted	to replace his old phone.
Because of PersonX visits PersonY's grandparents, PersonX wanted	to have company
Because of PersonX checks the oil, PersonX wanted	to make sure the car is alright
Because of PersonX quickly grabbed ___, PersonX wanted	to hit the ball
Because of PersonX does n't go well, PersonX wanted	none
Because of PersonX pays PersonY's visit, PersonX wanted	to see persony
Because of PersonX carries PersonX's ___ far, PersonX wanted	to be vindicated
Because of PersonX drives home in PersonX's new car, PersonX wanted	they need to go somewhere
Because of PersonX stands up and be counted, PersonX wanted	to be noticed
Because of PersonX asks PersonY's family, PersonX wanted	to ask their family
Because of PersonX lets PersonY down gently, PersonX wanted	to show concern for others
Because of PersonX starts lifting weights, PersonX wanted	to be healthy
Because of PersonX joins the basketball team, PersonX wanted	part of a team
Because of PersonX receives a text, PersonX wanted	none
Because of PersonX pulls PersonY closer, PersonX wanted	whisper something
Because of wait in line, PersonX wanted	get
Because of PersonX packs PersonX's backpack, PersonX wanted	to have everything required
Because of PersonX affords a car, PersonX wanted	to have transportation
Because of PersonX gets ___ straight, PersonX wanted	resolution.
Because of PersonX takes ___ fishing, PersonX wanted	to bring someone fishing
Because of PersonX decides to lose weight, PersonX wanted	to look better
Because of PersonX gives the kitten ___, PersonX wanted	his kitten to have some food
Because of PersonX wants to go there, PersonX wanted	to be relaxed
Because of PersonX builds PersonX's ___ in french in, PersonX wanted	to educated
Because of PersonX watches a show, PersonX wanted	to learn more
Because of PersonX solves the ___ using, PersonX wanted	to finish their homework
Because of PersonX tries to surf, PersonX wanted	to learn something new
Because of PersonX buys PersonY drinks, PersonX wanted	to show appreciation
Because of PersonX plays very well, PersonX wanted	to be the best
Because of PersonX gives PersonY advantage, PersonX wanted	to go easy on them
Because of PersonX eats PersonY's flesh, PersonX wanted	to be punished
Because of PersonX likes very much, PersonX wanted	none
Because of PersonX arrives to school, PersonX wanted	good grades.
Because of PersonX commits to PersonY's charge, PersonX wanted	to be respectful
Because of PersonX crosses the line, PersonX wanted	to go to extreme
Because of PersonX goes home with PersonY, PersonX wanted	to  go home
Because of PersonX plays ___ after school, PersonX wanted	to be healthy.
Because of PersonX bases upon data, PersonX wanted	correct
Because of PersonX answers the phone, PersonX wanted	to talk to who called
Because of PersonX sees my dog, PersonX wanted	to check his condition
Because of PersonX opens a new bank account, PersonX wanted	to find a new institution
Because of PersonX lets it be, PersonX wanted	to let well-enough alone
Because of PersonX takes PersonY to disneyland, PersonX wanted	to make y happy
Because of PersonX drinks alcohol, PersonX wanted	to relax for the evening
Because of PersonX sells PersonX's land, PersonX wanted	unburden themselves
Because of PersonX smells bad, PersonX wanted	none
Because of PersonX thinks PersonY was weird, PersonX wanted	none
Because of PersonX writes PersonY answer, PersonX wanted	to help persony
Because of PersonX quickly found ___, PersonX wanted	none
Because of PersonX depends upon the temperature, PersonX wanted	to decide what to wear.
Because of PersonX returns it to PersonY, PersonX wanted	TO BE SOCIAL
Because of PersonX feels like a fool, PersonX wanted	none
Because of PersonX challenges PersonY's brother, PersonX wanted	to see persony romantically
Because of PersonX takes lessons, PersonX wanted	to learn guitar
Because of PersonX wears PersonX's ___ long, PersonX wanted	to be individualistic
Because of PersonX drives to school, PersonX wanted	to learn
Because of PersonX uses PersonX's knowledge, PersonX wanted	to elaborate his knowledge
Because of PersonX never paid attention, PersonX wanted	to pay attention to themselves first
Because of PersonX asks PersonY's son, PersonX wanted	to know the answer
Because of PersonX pushes ___ into the pool, PersonX wanted	to play around.
Because of PersonX pursues PersonX's course, PersonX wanted	to achieve his ambition
Because of PersonX knocks ___ to the ground, PersonX wanted	because he wanted to be a bully
Because of PersonX is cleaning out PersonY's garage, PersonX wanted	to help organize
Because of PersonX visits ___ today, PersonX wanted	to see something
Because of PersonX is painting PersonX's nails, PersonX wanted	to look cute
Because of PersonX makes popcorn on the stove, PersonX wanted	to feel satisfied
Because of PersonX is four years old, PersonX wanted	none
Because of PersonX tries to clean it up, PersonX wanted	to be accepted
Because of PersonX is finally done, PersonX wanted	to achieve a goal
Because of PersonX recurs every ___, PersonX wanted	to be attentive
Because of PersonX starts bleeding, PersonX wanted	none
Because of PersonX asks PersonY thought, PersonX wanted	to know what someone is thinking
Because of PersonX really loves, PersonX wanted	none
Because of PersonX gathers PersonY's ___ under PersonX's wings, PersonX wanted	to acquire something
Because of PersonX takes lots of photos, PersonX wanted	to remember the places they went to in their vacation
Because of PersonX uses PersonY's ___ to make, PersonX wanted	willing to make
Because of PersonX eats too many sweets, PersonX wanted	to eat candy
Because of PersonX carries these ___ into effect, PersonX wanted	to act
Because of PersonX serves PersonY's ___ well, PersonX wanted	to help the other person
Because of PersonX stands shoulder to shoulder, PersonX wanted	to make room
Because of PersonX wants PersonX's ___ back, PersonX wanted	to have a possesion again
Because of PersonX gets better ___, PersonX wanted	to do better
Because of PersonX spends ___ with PersonY's family, PersonX wanted	to show love for his family
Because of PersonX meets new people, PersonX wanted	to fulfill duties such as at a new job
Because of PersonX cooks meal, PersonX wanted	to eat
Because of PersonX sees what the noise was, PersonX wanted	to know
Because of PersonX shares PersonY's life, PersonX wanted	to always be with persony
Because of PersonX catches PersonY napping, PersonX wanted	to find out what persony is doing.
Because of PersonX gives ___ a treat, PersonX wanted	to make his pet happy
Because of PersonX waits to go, PersonX wanted	accompany his parents
Because of PersonX calls to complain, PersonX wanted	to be heard
Because of PersonX shifts PersonY's weight, PersonX wanted	to change linens
Because of PersonX has lots of fun, PersonX wanted	to get some relaxation
Because of PersonX goes for the gold, PersonX wanted	to experience success.
Because of PersonX trains PersonX's dog, PersonX wanted	it to behave
Because of PersonX considers another ___, PersonX wanted	alternatives
Because of PersonX defends PersonX's interests, PersonX wanted	he feels his intrests are important
Because of PersonX plays ___ for hours, PersonX wanted	to enjoy themselves
Because of PersonX publishes PersonX's work, PersonX wanted	help other people
Because of PersonX lets nature take its course, PersonX wanted	to allow something to happen naturally
Because of PersonX makes new friends, PersonX wanted	to have friends
Because of PersonX goes around PersonY, PersonX wanted	to be unnoticed
Because of PersonX sends PersonY to PersonZ's room, PersonX wanted	to have time alone
Because of PersonX gets PersonX's shine box, PersonX wanted	hurtful
Because of PersonX listens to PersonY's mom, PersonX wanted	none
Because of PersonX hats dogs, PersonX wanted	none
Because of PersonX opens PersonY's gift, PersonX wanted	see what's inside
Because of PersonX buys a new jacket, PersonX wanted	to be warmer
Because of PersonX forgets PersonX's money, PersonX wanted	none
Because of PersonX opens a small business, PersonX wanted	to make money
Because of PersonX goes ice skating, PersonX wanted	to compete with other skaters.
Because of PersonX causes PersonY anxiety, PersonX wanted	none
Because of PersonX quickly turned around, PersonX wanted	to tell his friend to come to his house for dinner.
Because of PersonX sends text messages, PersonX wanted	to communicate with others
Because of PersonX drives my car, PersonX wanted	to go to school.
Because of PersonX gets PersonY's friends, PersonX wanted	get the surprise party set up
Because of PersonX decides to get a job, PersonX wanted	to contribute
Because of PersonX eats at a diner, PersonX wanted	convenience
Because of PersonX fills PersonY's mouth, PersonX wanted	to keep person from talking so much
Because of PersonX moves to a new country, PersonX wanted	to explore
Because of PersonX seeks ___ from others, PersonX wanted	to get input from others
Because of PersonX studies all night, PersonX wanted	to do good on finals
Because of PersonX learns karate, PersonX wanted	to be strong
Because of PersonX hears PersonX's mother 's ___, PersonX wanted	none
Because of PersonX glances behind PersonY, PersonX wanted	to pay attention
Because of PersonX works all the time, PersonX wanted	to make a lot of money.
Because of PersonX smells the barn, PersonX wanted	see if somethings clean
Because of PersonX makes PersonY sick, PersonX wanted	none
Because of PersonX finds PersonX's ___ in life, PersonX wanted	to be fulfilled
Because of PersonX finally met ___, PersonX wanted	to make friends
Because of PersonX offer PersonY explanation, PersonX wanted	sorry
Because of PersonX stops the presses, PersonX wanted	cause a disturbance
Because of PersonX makes tea, PersonX wanted	to drink tea
Because of PersonX completes PersonX's assignment, PersonX wanted	to complete a task
Because of PersonX takes PersonY's dog for a walk, PersonX wanted	to be helpful
Because of PersonX takes PersonY's seats, PersonX wanted	none
Because of PersonX seeks work, PersonX wanted	to make money
Because of PersonX holds PersonY's face, PersonX wanted	to comfort someone
Because of PersonX puts PersonY's ___ into practice, PersonX wanted	to do something
Because of PersonX watches some tv, PersonX wanted	to relax.
Because of PersonX likes ___ a lot, PersonX wanted	none
Because of PersonX moves into a new apartment, PersonX wanted	a better neighborhood
Because of PersonX stays home and rest, PersonX wanted	to relax
Because of PersonX rides my bike, PersonX wanted	to test out the bike
Because of PersonX wraps PersonY's arms around PersonY's neck, PersonX wanted	to hug person.
Because of PersonX breaks the cycle, PersonX wanted	to start anew
Because of PersonX gazes into PersonY's eyes, PersonX wanted	to make persony feel special
Because of PersonX eats ___ outside, PersonX wanted	to eat food
Because of PersonX maintains PersonX's balance, PersonX wanted	to remain standing
Because of PersonX leaves PersonX's ___ behind PersonY, PersonX wanted	persony to protect
Because of PersonX serves the food, PersonX wanted	to be helpful
Because of PersonX tries to catch PersonY's breath, PersonX wanted	to breathe correctly.
Because of PersonX watches PersonY's shows, PersonX wanted	personx feels persony's shows are informative
Because of PersonX turns the oven on, PersonX wanted	to cook food
Because of PersonX reads some books, PersonX wanted	to learn
Because of PersonX ties PersonY's hair, PersonX wanted	to help y look tidy
Because of PersonX follows another ___, PersonX wanted	to satisfy their curiosity
Because of PersonX tells PersonY's parents, PersonX wanted	to reveal information
Because of PersonX drops PersonY's bag, PersonX wanted	to stop holding the bag
Because of PersonX removes PersonY's fingers, PersonX wanted	to use the keyboard
Because of PersonX finds PersonY's ___ around, PersonX wanted	to make sure persony isn't lost
Because of PersonX drives ___ from work one night, PersonX wanted	to get to a destination
Because of PersonX accomplishes PersonX's work, PersonX wanted	to be successful
Because of PersonX finds PersonY's cat, PersonX wanted	to be helpful
Because of PersonX goes to the zoo with PersonY's family, PersonX wanted	to spend time with persony's family
Because of PersonX practices all week, PersonX wanted	to improve
Because of lose weight, PersonX wanted	feel good
Because of PersonX sells PersonX's ___ to the devil, PersonX wanted	to go to the dark side
Because of PersonX beats PersonY's friend, PersonX wanted	to teach him a lesson for his misbehaviour
Because of PersonX hits on PersonY, PersonX wanted	casual sex
Because of PersonX gives tom, PersonX wanted	to share
Because of PersonX treats the ___ lightly, PersonX wanted	easy to make understand
Because of PersonX reads PersonY's book, PersonX wanted	to learn more things by reading.
Because of PersonX means so much to PersonY, PersonX wanted	none
Because of PersonX acts funny, PersonX wanted	to amuse someone.
Because of PersonX fights another day, PersonX wanted	to get posponed
Because of PersonX sells PersonY's goods, PersonX wanted	to help persony
