You are likely to find liquid in	jar
You are likely to find folder in	file drawer
You are likely to find al gore in	orbit
You are likely to find jet ski in	beach
You are likely to find five and dime in	kansas
You are likely to find interstate highway in	state
You are likely to find wine in	resturant
You are likely to find waltz in	ballroom
You are likely to find moonie in	airport
You are likely to find space in	table
You are likely to find pearl in	oyster
You are likely to find handbag in	wardrobe
You are likely to find shower head in	shower cubicle
You are likely to find people in	room
You are likely to find person in	water cooler
You are likely to find screw in	tool box
You are likely to find automobile in	repair shop
You are likely to find table in	kitchen
You are likely to find concert hall in	theater
You are likely to find registry office in	office building
You are likely to find far in	orbit
You are likely to find debit card in	poket
You are likely to find cold storage in	freezer
You are likely to find ink in	squid
You are likely to find expressway in	michigan
You are likely to find sink in	neighbor's house
You are likely to find bone in	fish
You are likely to find letter opener in	office
You are likely to find green jalapeno jelly in	jar
You are likely to find music in	carnival
You are likely to find mammoth in ice in	russia
You are likely to find bridge arch in	countryside over river
You are likely to find coral in	bottom of sea
You are likely to find divider in	fork in road
You are likely to find cloth in	clothing store
You are likely to find matterhorn in	valais
You are likely to find corner shop in	iowa
You are likely to find religious tract in	church
You are likely to find fax machine in	office
You are likely to find shower stall in	apartment building
You are likely to find electricity in	opera
You are likely to find meal in	plate
You are likely to find bidet in	european bathroom
You are likely to find stranger in	bus station
You are likely to find front room in	front of building
You are likely to find fish in	resturant
You are likely to find shortcut in	desktop
You are likely to find marmoset in	underground
application is used for	get in to the school
permission slip is used for	use the restroom
light bulb is used for	shine bright
meals is used for	order and buy
car is used for	park in the parking lot
vehicle is used for	operate after the festival
mirror is used for	check blindspots
shoulder pads is used for	shield their upper body
fists is used for	mash potatoes
gong is used for	religious ceremonies
sacks is used for	carry clothes
flamethrower is used for	add to a halloween costume
lamp is used for	illuminating area
car ratings is used for	Get a good reputation as a seller
catering is used for	go into business
fruit is used for	producing juice
work policy manual is used for	give to employee
people is used for	race cars
postal van is used for	hide presents
aisles is used for	to separate items
change purse is used for	store pills
minister is used for	find comfort
matchbox strip is used for	scratch something with
requester is used for	ask your opinion
shredder is used for	grate cheese
toy is used for	utilize to bring pleasure
calendar pad is used for	remind myself of birthday
plastic is used for	soda bottles
bactine is used for	help a stray animal
staps is used for	tie up a hog
scale is used for	weighing items
items is used for	give to a charity"
spandex is used for	make leggings
dance partner is used for	do the jitterbug
power of attorney is used for	deal with the law
id is used for	figure out who it belongs to
stadium is used for	recreation and fun
police car is used for	put person y in
spoon is used for	eat bite-sized amounts
envelope is used for	send money
treats is used for	reward the dog
saddle is used for	decorate the house
banker is used for	banking
grill is used for	roasting meat
desk is used for	sit computer on
bag of beans is used for	massage their feet
point shoes is used for	use as wall decor
blender is used for	cut up the body into small pieces
clothes is used for	put on body
bullet is used for	shooting
tablet is used for	arrange the plot
internet is used for	search on
money card is used for	Reload with more money
conditoner is used for	make hair healthier
acoustic guitar is used for	folk music
shirt is used for	expressing fashion
mold is used for	lecture a class a students about
entry ticket/stub is used for	show to friends
money is used for	pay for their lunch
fancy cake is used for	show off your baking skills
home is used for	have a doorway in
lunchroom is used for	sit in
truck is used for	drive to restaurant
shirts is used for	cover windows
bubbly is used for	wash their hair
catscan is used for	sell to hospitals
sandwiches is used for	eat for lunch
baseball bat is used for	swing at ball
marraige liscence is used for	get a new drivers license
luggage is used for	carry off the boat
cell phone flashlight is used for	see in a dark theater
entertainment unit is used for	hold the television
officespace is used for	get a promotion
dish is used for	eating from
tape dispenser is used for	holding tape
sink is used for	to rinse the dishes
patch is used for	repair the drywall
tiolet is used for	charge someone to use at a concert.
peas is used for	blow at someone through a straw
napkins is used for	use as a coaster
course manual is used for	show someone how they're wrong
student loan is used for	buy a trailor
drain is used for	get rid of the water
hockey puck is used for	knock out teeth
video is used for	learn from
background report is used for	apply for a job
soapy water is used for	let kids play in
pedometer is used for	estimate number of calories burned
bases is used for	put on the field
polish is used for	create color coded labels for items
ads is used for	sell items
griddle is used for	make bacon
solicitor is used for	litigation
shards is used for	place in a bowl for fun
utility case is used for	carry tools
friend is used for	listen to problems
packets is used for	trace an IP route
bus is used for	traveling
beers is used for	spike punch with
keyboard is used for	enter information
coursebook is used for	make into a paperweight
hallway is used for	moving between rooms
account is used for	write on
divine powers is used for	remove evil
net is used for	hold hair up
backpack is used for	keep the supplies
bush is used for	hang a birdfeeder
trash can is used for	throw away potato
automotive store is used for	buy automotive accessories
paper is used for	bleached white or dyed different colors
nuteral location is used for	hold a negotiation
one is used for	adapt oneself to fit group
billing letter is used for	prove they owe money
boundary is used for	restricting access
loan application is used for	get a new car
phone is used for	contact PersonX for help
ironing board is used for	get wrinkles out of clothes
comic book is used for	read through
rowboat is used for	get across a lake
buggy is used for	to help when moving
defibrillator is used for	teach students how to restart hearts
makeup sponge is used for	even out the foundation
fork is used for	stab pieces
napkin is used for	clean face after eating
baseball is used for	pitching
tire guage is used for	determine is a tire is flat
light chain is used for	make an outfit prettier
supervisor is used for	oversee other's work
heart is used for	pumping
receipts is used for	hold in case the items don't fit
computer is used for	browse places to stay
document is used for	make a paper boat
finger is used for	picking cello
paint is used for	color surfaces
t shirt is used for	tie die to look good in
homemade meal is used for	show off your cooking skills
cow is used for	get ribeye steaks from
new page is used for	use to wrap
scissors is used for	cut the paper to the appropriate size
bill file is used for	storing financial documents
doggy bag is used for	share with my neighbor who's also on the dog trail
beam is used for	joining two structures horizontally
garbage pail is used for	use as the bottom part of a grill
rescue hook is used for	create a door opener
cell phone is used for	play games on while they wait
ingredients is used for	prepare the meal from
bullet journal is used for	make a paper airplane
department store is used for	shopping
gasoline is used for	power transportation
cat litter is used for	prank someone with
running shoes is used for	jog on the treadmill
ambulance is used for	get there
phone number is used for	contact for service
capital is used for	test a weapon
pen is used for	write the speech
clothes pins is used for	avoid the clothes from falling
hair dye is used for	color hair with
bluetooth ear bud is used for	stop a small leak
hand strap is used for	prevent falls
meat pie is used for	serve lunch
stage makeup is used for	fit the part of the play
champagne is used for	celebrate victory
gun is used for	apply force
coins is used for	put in the machines
cheque book cover is used for	covering check book
chips is used for	crunch for audio file making
pickles is used for	enjoy as a snack
stick is used for	balance with
sports watch is used for	show off to friends
measuring cups is used for	produce the right amounts
convertible is used for	race into
bathroom with toilet is used for	removal of bodily wastes
refrigerator freezer is used for	keeping ice packs frozen
shore is used for	docking boat
leaves is used for	cover fresh dirt
salad dressing is used for	give flavor to lettuce
writing instrument is used for	mark lines on a test
electronics store is used for	buying electrical goods
softball is used for	paint and hang on a Christmas tree
vegetable garden is used for	grow courgettes
dictionary is used for	word definition
hourglass is used for	keep track of time
reference list is used for	show that you used someone else's works
club outfit is used for	keep up with the younger people
air conditioner is used for	cool car
carry-on luggage is used for	hide presents in under your bed
knifes is used for	perform surgery
apartment is used for	go from room to room
electronic equipment is used for	track financials
basket or baskets is used for	use as a baby carrier.
trunk is used for	Place tent into
leak is used for	make a mess
journal is used for	jot down ideas
vhs tapes is used for	recall old memories
flowers is used for	mark the somber occasion
cleaner solution is used for	sell in a garage sale
picture hangers is used for	attach to the screws
caddy full of instruments is used for	Pick up
hiking boots is used for	use as a doorstop
cloth is used for	bind book
whistle is used for	make students pay attention
bike is used for	get to the ferry
gym pass is used for	enter restricted areas
vpn is used for	hack into accounts
company is used for	donate to
rubber gloves is used for	prevent their hands being burnt
furniture spray is used for	moisturize wood
vaccum cleaner is used for	make hickeys on skin
collars is used for	hold keys as a key chain
steering wheel is used for	make transportation go in a direction
phone carrier is used for	store money in, instead of a wallet
debit card reader is used for	skim someones information
discothque is used for	dancing and socializing
cushion is used for	place on the chair before they sit
brochure is used for	to market goods
telephone directory is used for	looking up telephone numbers
cycling bag is used for	make into a hat
wheel is used for	allow it to move
radio is used for	hearing news
hand coverinngs is used for	look attractive
cash is used for	give to the vendor
entrance fee is used for	make people like you by paying for them
initial deposit is used for	prepay damages
funds is used for	pay for events
nice clothing is used for	wear to a wedding
key is used for	open entrance
tuxedo is used for	look good
stove is used for	cook food on
hardrail is used for	help the old person climb the stairs
sadle is used for	fall off of
bottled water is used for	soothe throat with
optical equipment is used for	lose when a monster chases you
wine is used for	to enjoy with partner
alarm code is used for	stop intruders from breaking in
room number is used for	dial a friend who is visiting town
reciepts is used for	see from a motel
stethoscope is used for	pretend to be a doctor
van is used for	ride to the car store
blow dryer is used for	dry clothes
winning ticket is used for	show that they won the lottery
tapeholder is used for	melt into a decorative ornament for the tree
tennis ball is used for	throwing to dog
rolling paper is used for	make cigarettes
van/truck is used for	use in a demolition derby
jockstrap is used for	carry some items as a purse
stool is used for	support
golf clubs is used for	relax and enjoy a day
prybar is used for	open a locked door
skipping rope is used for	get a good work out
hospital room is used for	perform surgery
canvass is used for	use as a walkway over a stream
coaster is used for	test their drink for roofies
sign up sheet is used for	indicate intent
laundry card is used for	budget how much is spent for laundry
baseball ticket is used for	attending baseball game
eiffel tower is used for	showing off strength of steel
gas is used for	make the car drive
clavichord is used for	making music
checker pieces is used for	sell online to other collectors
padding is used for	keep toys safe while in storage
duvet cover is used for	make duvet look nice
display cabinet is used for	displaying
towel is used for	wipe stain
blank piece of paper is used for	sketch drawings or diagrams
lottery tickets is used for	split winnings
dime store is used for	inexpensive goods
meal ticket is used for	purchase food
list is used for	know what to look for
costume is used for	look like the character
medicine is used for	sell on the street for beaucoup dollars
teakettle is used for	boil water for tea
practice book is used for	learn techniques
procedure manual is used for	know what to do
sign is used for	write what they are selling
swimming pool is used for	cool off guests
hitch is used for	hit the robber in the head
paper tube is used for	smack a fly
brake pad is used for	stop the cab
line is used for	demark tennis court
bookcase is used for	take books off of
boat is used for	go over the water
music is used for	lift one's spirits
dimes is used for	tile a floor
trucks is used for	blast through a crash gate
library card is used for	take the books home
ambition is used for	hunt down a violent criminal
crossbow is used for	perform in a circus
bus pass is used for	getting around
wine glasses is used for	drink from
sporting equipment is used for	Exercise
airplane is used for	seat passengers
water spit is used for	get a drink
chromecast is used for	stream your favorite shows
blinds is used for	push to the side to get to door handle
corsage is used for	give to their prom
waiting room is used for	eat lunch in
cookie is used for	decorate for the holidays
glasses is used for	pour water into
ice is used for	keep the drink cool
popcorn bucket is used for	hold a plant
person wants	material goods
people wants	belong to groups
somw poeple wants	watch sports
cold person wants	warm
human wants	alone
teacher wants	teach
jockey wants	win races
buzzard wants	dead carcasses
cat wants	food now
defesnse lawyer wants	defend client
spy wants	information
normal person wants	love and respect
skiier wants	snow
fish wants	food
humanity wants	live
lonely person wants	friends
hungry person wants	food
puppy wants	attention
hard worker wants	work
scientist wants	conduct research
virus wants	live
chihuahua wants	kept warm
hamster wants	food water and nice burrow
candidate for public office wants	win election
dog wants	eat
programmer wants	automate things
politician wants	win elections
astronaut wants	travel in space
clown fish wants	hide for protection in anemities
american wants	enjoy civil rights
monkey wants	eat banana
judge wants	justice
tax collector wants	money
chipmunk wants	nuts
soldier wants	get out alive
boss wants	work
company wants	profits
koala bear wants	eucalyptus leaves to eat
sick person wants	heal
vegetarian wants	avoid eating meat
child wants	eat only ice cream
rabbit wants	carrot
old man wants	retire
funeral director wants	dead people
addict wants	drug
musician wants	make music
if dog wants	go out better let
penguin wants	enough to eat
priest wants	confess sins
gay men wants	have sex with other men
waiter wants	people to tip well
baby wants	comfort
illegal alien wants	better life
comedian wants	make people laugh
plant wants	water and sun
bear wants	eat campers
junkie wants	fix
student wants	easy exam
golddigger wants	rich man
everyone wants	victory in war
accountant wants	balance
worker wants	get paid
chef wants	cook well
police wants	know when crimes committed
doctor wants	big fancy house
horse wants	carrots
saint wants	good
bird wants	fly
drug addict wants	drugs
little girl wants	pony
mathmatician wants	equality
animal wants	reproduce
catepillar wants	fresh leaves to eat
goat wants	food
marketer wants	sell things
mosquito wants	fresh blood
lazy person wants	do very little
diva wants	sing
little kid wants	christmas every day
suicidal person wants	die
insecure person wants	lot of attention from others
victim wants	closure
missionary wants	people to believe religion
mayor wants	motivated city counselors
computer wants	learn to understand human language
kangaroo wants	jump
japanese wants	eat raw fish
fireman wants	extinguish fires
life form wants	food
thoroughbred wants	run
employee wants	raise
speeder wants	radar detector
sleeper wants	just right pillow
bunny wants	hop
dictator wants	total control over people
policeman wants	prevent crime
wise man wants	help improve world
lion wants	mate
printer wants	paper
goldfish wants	bowl
crocodile wants	in river
shark wants	eat
marxist wants	class equality
young man wants	cool car
snake wants	live mice
love wants	live
rich person wants	recognized as being rich
rugby player wants	win
axe murderer wants	helpless victims
gambler wants	win money
parasite wants	host
author wants	people to buy books
organism wants	live
turtle wants	water
insecure man wants	flashy car
band wants	get signed to label
narcissist wants	admiration
landlord wants	tenant to pay rent
angry person wants	vent
thirsty person wants	drink
spot wants	run
troll wants	kill people
forester wants	healthy trees in forest
hooker wants	trick
squirrel wants	nuts
lady wants	diamonds
french wants	cook duck
terrier wants	dig
banker wants	loans to repaid
busy mom wants	break
tourist wants	room with view
game show contestant wants	right answers
homeless person wants	shelter
unicorn wants	with virgin
sailor wants	wind
hiker wants	sturdy comfortable shoes
hobo wants	pie
professor wants	smart students
control freak boss wants	reports on everything
bum wants	handout
pirate wants	booty
pilot wants	fly
baker wants	good quality ingredients
underage drinker wants	hide evidence of drinking
spider wants	eat insects
good person wants	recognition of deeds
flower is	picked
enthusiasm is	contagious
compliment is	better than flattery
library is	books for loan
flag is	found in school
people is	driven to school in car
bistoury is	slender
mountain is	very large
joke is	offensive
cheese is	flavor
trombone is	long
lead is	very heavy
rock is	heavy
meat is	taken from freshly killed animals
highway is	weigh stations on
wood is	made into pulp
ship is	found on water
jelly is	made from fruit
carpet is	found in house
deer is	found in woods
luck is	unpredictable
bushel is	equivalent to 4 pecks
blender is	on off switch
oil is	found in paint
mud is	very sticky
creek is	runnign water in
house is	bathroom
shark is	rough skin
trash bag is	left at curbside for pickup
dozen is	twelve
diamond is	rare and difficult to find
squid is	found in ocean
intelligence is	important for success
music is	written as score
child is	produced by sexual intercourse
seat is	sticky
bladder is	stretchable
beer is	made from fermented grains
collage is	expensive
hyakugojuuichi is	japanese for one hundred and fifty one
smoke is	harmful to animal's health
water is	more wet than air
instant ramen is	very inexpensive
air is	composed of gases
status is	important to people
ballons is	filled with helium
life is	full of chance
criminal is	given sentence
faucet is	found in kitchen
cat is	nose
helium is	atomic weight of four
b.b.king is	one master of blues music
champagne is	bubbles
pee is	warm
sausage is	eaten
temperature is	expressed in degrees
bus is	driven
bread is	made from grain
milk is	sold in plastic containers
debit card is	linked electronically to bank account
wind is	very strong
internet is	lots of information
elephant is	four legs
pig is	rolling in mud
company is	assets
guitar is	6 strings
thirty is	ten more than twenty
orange juice is	one kind of breakfast drink
manganese is	hard and very brittle
china is	largest population on earth
waste basket is	trash
frog is	found in marsh
letter is	mailed via usps
flask is	liquid
wristwatch is	digital or analog
animal is	locked up in cage
comforter is	found on bed place
education is	obtained by going to school
chocolate is	eaten
curve is	smooth
wine is	alcohol
lipstick is	carried in purse
dog is	one among many animals
shirt is	worn to office
duck is	feathers
icecream is	cold
desk drawer is	paper
sun is	composed mainly of element hydrogen
bob is	very painful toothache
radiation is	harmful to humans
ranch is	horses
engine is	found in car
person is	entertained by movies
dice is	used in gambling
siberia is	east of ural mountains
everyone is	different sides to personalities
talk is	cheap
electricity is	dangerous to people
closet is	found in motel
student is	supposed to learn
torso is	one head
sugar is	bad for diabetic person
cd is	music
bedroom is	chairs
soccer is	played on field of grass
tree is	roots branches leaves and trunk
nation is	people
business is	opening early
cereal is	bought in store
vasectomy is	less risky than female sterilization
bowl is	convex down
door is	rectangular in shape
vagueness is	irritating
game is	played for enjoyment
bullet is	used in gun
coffee is	caffeine which raises brain reaction time
apple pie is	crust filled with apples
paper is	printed on by printer
fan is	blades
hair is	woven
sea is	salt
dental office is	waiting room
iron is	cast
food is	eaten from plates
ink is	used as verb
lemmon is	sour
grain is	dried in grain bin
mumps is	undesirable
winter is	normal and useful
fish is	distinctive fishy smell
scooter is	cheap to run
counter is	likely to hold cash register
lava is	hot
necklace is	worn around neck
comfortable bed is	easy to fall asleep on
wedding is	ceremony followed by reception
ocean is	waves
money is	exchanged for goods at stores
kindness is	reciprocal
costa is	french for coast or beach
pad of paper is	handy for jotting down notes
boredom is	avoidable
lake is	made up of water
jello is	translucent
fire is	essential
news is	broadcast on radio
scale is	helpful in making comparisons
dinner is	cooked on grill
sleep is	necessary
lightning is	very dangerous even deadly
bracelet is	worn around wrist
flat is	at least one doorway
cubicle is	found in office
tearoom is	tables and chairs
time is	spent
shadow is	dark
book is	been written by author
mouth is	teeth in
address label is	fixed on envelope
judge is	primission to give sentence
cord is	tied
doormat is	found outside door
mercury is	toxic
asphalt is	opaque
cello is	like violin but larger
gashi is	japanese for greetings
furniture is	bought at market
wagon is	wheels
sunburn is	painful
marijuana is	smoked
horse is	ridden
brain is	tens of billions of neurons
store is	opening early
ocd is	pathological doubt
telephone box is	telephone
actor is	different from role plays
roof is	found on topof house
depression is	depressing
mail is	delivered to mail box
diesel is	made from oil
liquid is	weaker internal forces than solid
jeep is	windows
restaurant is	considered to public place
everything is	intricate if look close enough
cotton is	absorbent
car is	slow
ruby is	red
porcelain is	shiny and hard and usually white
light is	required to see things
stacey is	kids
ice is	melting
glass is	found in building
bath is	found in house
school is	boring
shower curtain is	located near shower
minute is	sixty seconds in
advantage is	gained through hard work
france is	about 60 million inhabitants
cyberspace is	full of cybercriminals
work is	hard
soap is	used in shower
fire hydrant is	used by fire department
knowledge is	converted to power
insurance is	defined in law
air conditioner is	very important in warm climates
heart is	natural or artificial
outside is	painted
postage stamp is	adhesive on back
everybody is	name
room is	walls and roof
sheet is	found on bed
bathroom is	dark
linux is	better than windows
garbage is	collected in landfill
greed is	evil
paint is	used on canvas
basketball court is	two halves
recreation is	fun
civilization is	unnatural
fame is	fleeting
bonjour is	french for hello
television is	addictive
stone is	opaque
office will is	files
head is	teeth
jokester is	being cute
body is	made up of many organs
telemarketers is	scripts
dew is	wet
cream is	whipped
audience is	comprised of african people
confusion is	irritating
unbrella is	open or closed
tea is	about 2 to 3 caffeine
tissue holder is	tissues
typewriter is	many keys
punishment is	given to people who break laws
gerbles is	furry
fuel is	needed to process
queen is	married to king
cork is	used as bottle stopper
window pane is	transparent
aeroplane is	more expensive than c ar
long rope is	very useful
bag is	designed for carrying items
hot water is	necessary to make coffee
floor is	wet
whiskey is	very tasty
sound is	caused by vibrations in substance
towel is	found in sauna
bed is	found in house
mozilla is	cool
satchel bag is	handles
mathematics is	useful in business
earth is	dirt
triangle is	three vertices
trail is	smooth
body and mind must is	rest
graveyard is	grave
wallpaper is	applied perpendicularly to ceiling
lap belt is	found in car
tennis court is	net dividing in half
large is	wide
care is	required to pass big rig
peppermint is	opaque
leg is	covered by pants
canal is	man made
cash is	denominated in dollars
friend is	special place in ones heart
park is	dark
